{
  "$schema": "../schema/aboutty.schema.json",
  "title": "profile",
  "username": "aboutty",
  "usernameSeparator": "@",
  "hostname": "profile",
  "cwdSeparator": ":",
  "cwd": "~",
  "prompt": "$",
  "cursor": {
    "enabled": true,
    "style": "outline",
    "blinkIntervalMs": 700
  },
  "stepIntervalMs": 350,
  "typingIntervalMs": 28,
  "theme": {
    "background": "#0f1412",
    "username": "#8bd5ca",
    "usernameSeparator": "#94e2d5",
    "hostname": "#a6e3a1",
    "cwdSeparator": "#b4f8c8",
    "cwd": "#c3e88d",
    "prompt": "#89dceb",
    "text": "#f4f7f2",
    "cursor": "#f4f7f2"
  },
  "steps": [
    {
      "type": "command",
      "text": "whoami"
    },
    {
      "type": "output",
      "typingIntervalMs": 0,
      "text": [
        {
          "value": "name: ",
          "color": "#a6adc8"
        },
        {
          "value": "aboutty maintainer",
          "color": "#f4f7f2",
          "bold": true
        }
      ]
    },
    {
      "type": "command",
      "text": "gh api users/aboutty"
    },
    {
      "type": "output",
      "typingIntervalMs": 0,
      "text": [
        {
          "value": "login:      ",
          "color": "#a6adc8"
        },
        {
          "value": "aboutty\n",
          "color": "#f4f7f2",
          "bold": true
        },
        {
          "value": "followers:  ",
          "color": "#a6adc8"
        },
        {
          "value": "128\n",
          "color": "#a6e3a1",
          "bold": true
        },
        {
          "value": "following:  ",
          "color": "#a6adc8"
        },
        {
          "value": "24",
          "color": "#8bd5ca",
          "bold": true
        }
      ]
    },
    {
      "type": "command",
      "text": "gh api graphql -f query=@profile.graphql"
    },
    {
      "type": "output",
      "text": [
        {
          "value": "collecting profile data\n",
          "color": "#f4f7f2"
        },
        {
          "frames": [
            "activity      pending\nlanguages     pending\nrecent events  pending",
            "activity      ok\nlanguages     pending\nrecent events  pending",
            "activity      ok\nlanguages     ok\nrecent events  pending",
            "activity      ok\nlanguages     ok\nrecent events  ok"
          ],
          "frameIntervalMs": 200,
          "color": "#a6e3a1"
        }
      ]
    },
    {
      "type": "output",
      "typingIntervalMs": 0,
      "text": "CONTRIBUTIONS  1,248\nTOP LANGUAGE   TypeScript\nRECENT         pushed aboutty@main"
    },
    {
      "type": "command",
      "text": "aboutty profile.json --out assets/profile.svg"
    },
    {
      "type": "output",
      "text": [
        {
          "frames": [
            "write profile header   [####------]",
            "write activity block   [######----]",
            "write language summary [########>-]",
            "write language summary [==========]"
          ],
          "frameIntervalMs": 160,
          "color": "#a6e3a1"
        },
        {
          "value": "\nGenerated assets/profile.svg",
          "color": "#f4f7f2"
        }
      ]
    }
  ]
}
