{
  "$schema": "../schema/aboutty.schema.json",
  "title": "aboutty tutorial",
  "username": "aboutty",
  "usernameSeparator": "@",
  "hostname": "dev",
  "cwdSeparator": ":",
  "cwd": "~",
  "prompt": "$",
  "loop": true,
  "cursor": {
    "enabled": true,
    "style": "block",
    "blinkIntervalMs": 650
  },
  "stepIntervalMs": 350,
  "typingIntervalMs": 35,
  "theme": {
    "background": "#101418",
    "username": "#6ee7b7",
    "usernameSeparator": "#8bd5ca",
    "hostname": "#93c5fd",
    "cwdSeparator": "#7dd3fc",
    "cwd": "#a7f3d0",
    "prompt": "#5eead4",
    "text": "#f8fafc",
    "cursor": "#f8fafc"
  },
  "steps": [
    {
      "type": "output",
      "typingIntervalMs": 0,
      "text": [
        {
          "color": "#6ee7b7",
          "value": "      ___.                  __    __          \n_____ \\_ |__   ____  __ ___/  |__/  |_ ___.__.\n\\__  \\ | __ \\ /  _ \\|  |  \\   __\\   __<   |  |\n / __ \\| \\_\\ (  <_> )  |  /|  |  |  |  \\___  |\n(____  /___  /\\____/|____/ |__|  |__|  / ____|\n     \\/    \\/                          \\/     "
        }
      ]
    },
    {
      "type": "command",
      "text": "cat aboutty.json"
    },
    {
      "type": "output",
      "typingIntervalMs": 0,
      "text": "{\n  \"title\": \"aboutty demo\",\n  \"prompt\": \"$\",\n  \"steps\": [\n    { \"type\": \"command\", \"text\": \"pnpm test\" },\n    { \"type\": \"output\", \"text\": \"Tests passed\" }\n  ]\n}"
    },
    {
      "type": "command",
      "text": [
        {
          "value": "npx",
          "color": "#f8fafc"
        },
        {
          "value": " aboutty",
          "color": "#6ee7b7"
        },
        {
          "value": " aboutty.json --out assets/aboutty.svg"
        }
      ]
    },
    {
      "type": "output",
      "text": [
        {
          "value": "aboutty\n",
          "color": "#94a3b8"
        },
        {
          "frames": [
            "read   aboutty.json",
            "check  schema/aboutty.schema.json",
            "build  terminal timeline",
            "write  assets/aboutty.svg"
          ],
          "frameIntervalMs": 180,
          "color": "#f8fafc"
        }
      ]
    },
    {
      "type": "output",
      "typingIntervalMs": 0,
      "text": [
        {
          "value": "Generated ",
          "color": "#f8fafc"
        },
        {
          "value": "assets/aboutty.svg",
          "color": "#6ee7b7",
          "bold": true
        }
      ]
    },
    {
      "type": "command",
      "text": "printf '<img src=\"assets/aboutty.svg\" alt=\"aboutty\" />\\n' >> README.md"
    },
    {
      "type": "output",
      "typingIntervalMs": 0,
      "text": [
        {
          "value": "README.md ",
          "color": "#94a3b8"
        },
        {
          "value": "updated",
          "color": "#6ee7b7",
          "bold": true
        }
      ]
    }
  ]
}
