{
  "$schema": "../schema/aboutty.schema.json",
  "title": "signal console",
  "username": "operator",
  "usernameSeparator": "@",
  "hostname": "node-07",
  "cwdSeparator": ":",
  "cwd": "~",
  "prompt": ">",
  "loop": true,
  "cursor": {
    "enabled": true,
    "style": "underline",
    "blinkIntervalMs": 420
  },
  "stepIntervalMs": 350,
  "typingIntervalMs": 18,
  "theme": {
    "background": "#020403",
    "border": "#163d2a",
    "title": "#68d391",
    "username": "#22c55e",
    "usernameSeparator": "#4ade80",
    "hostname": "#16a34a",
    "cwdSeparator": "#86efac",
    "cwd": "#bbf7d0",
    "prompt": "#15803d",
    "text": "#d1fae5",
    "command": "#bbf7d0",
    "output": "#86efac",
    "cursor": "#bbf7d0"
  },
  "steps": [
    {
      "type": "output",
      "typingIntervalMs": 0,
      "text": [
        {
          "value": "SIGNAL // NODE-07\n",
          "color": "#4ade80",
          "bold": true
        },
        {
          "value": "local monitor online",
          "color": "#86efac"
        }
      ]
    },
    {
      "type": "command",
      "text": "systemctl --user status aboutty-monitor --no-pager"
    },
    {
      "type": "output",
      "typingIntervalMs": 0,
      "text": "aboutty-monitor.service - Local terminal signal monitor\n   Loaded: loaded\n   Active: active (running)\n Main PID: 4217 (node)"
    },
    {
      "type": "command",
      "text": "journalctl --user -u aboutty-monitor -n 4 --no-pager"
    },
    {
      "type": "output",
      "text": [
        {
          "frames": [
            "Jun 25 19:21:03 node-07 monitor[4217]: loading config ./ops/signal-console.toml",
            "Jun 25 19:21:03 node-07 monitor[4217]: renderer cache warm",
            "Jun 25 19:21:04 node-07 monitor[4217]: accepted local read-only session",
            "Jun 25 19:21:04 node-07 monitor[4217]: wrote heartbeat to /tmp/aboutty.sock"
          ],
          "frameIntervalMs": 180,
          "color": "#4ade80"
        }
      ]
    },
    {
      "type": "command",
      "text": "curl -sS http://127.0.0.1:8787/health | jq ."
    },
    {
      "type": "output",
      "text": [
        {
          "value": "requesting health endpoint ",
          "color": "#86efac"
        },
        {
          "frames": [
            "|",
            "/",
            "-",
            "\\",
            "ok"
          ],
          "frameIntervalMs": 120,
          "color": "#22c55e"
        },
        {
          "value": "\n",
          "color": "#86efac"
        },
        {
          "value": "{\n  \"status\": ",
          "color": "#86efac"
        },
        {
          "value": "\"ok\"",
          "color": "#22c55e",
          "bold": true
        },
        {
          "value": ",\n  \"queueDepth\": 0,\n  \"latencyMs\": 12\n}",
          "color": "#86efac"
        }
      ]
    },
    {
      "type": "command",
      "text": "scan --local ./signals --limit 4"
    },
    {
      "type": "output",
      "text": [
        {
          "frames": [
            "scan ./signals [###-----------------] 07-A",
            "scan ./signals [########------------] 07-B",
            "scan ./signals [##############------] 07-C",
            "scan ./signals [####################] complete"
          ],
          "frameIntervalMs": 150,
          "color": "#4ade80"
        },
        {
          "value": "\n07-A clean  12ms\n07-B clean  18ms\n07-C clean  09ms",
          "color": "#d1fae5"
        }
      ]
    },
    {
      "type": "command",
      "text": "sha256sum ./assets/signal-console.svg"
    },
    {
      "type": "output",
      "typingIntervalMs": 0,
      "text": "7b4f7d1c8d1c3c5c  ./assets/signal-console.svg"
    },
    {
      "type": "command",
      "text": "openssl dgst -sha256 ./reports/session.txt"
    },
    {
      "type": "output",
      "typingIntervalMs": 0,
      "text": "SHA2-256(./reports/session.txt)= 2f8b8a5b6a0d9e21"
    }
  ]
}
